{
  "case_id": "record-012",
  "certificates": [
    {
      "cert_id": "CCC-2026-7788A",
      "events": [
        {
          "at": "2026-01-05T09:00:00+08:00",
          "kind": "issued",
          "models": ["RC-01 遥控车"]
        },
        {
          "at": "2026-05-01T10:00:00+08:00",
          "kind": "suspended"
        },
        {
          "at": "2026-05-20T10:00:00+08:00",
          "kind": "restored"
        },
        {
          "at": "2026-08-15T09:30:00+08:00",
          "kind": "rebound",
          "models": ["RC-01 遥控车", "RC-02 遥控车"]
        }
      ]
    }
  ],
  "batches": [
    {
      "batch": "B-20260312-01",
      "model": "DB-01 积木恐龙",
      "packaging_version": "PV-1",
      "printed_cert": "CCC-2026-7788A",
      "produced_at": "2026-03-12T14:00:00+08:00",
      "quantity": 100
    },
    {
      "batch": "B-20260420-02",
      "model": "DB-02 积木飞船",
      "packaging_version": "PV-1",
      "printed_cert": "CCC-2026-7788A",
      "produced_at": "2026-04-20T14:00:00+08:00",
      "quantity": 60
    }
  ],
  "evidence": [
    {
      "kind": "warehousing",
      "at": "2026-03-13T09:30:00+08:00",
      "ref": "EV-WH-01",
      "batch": "B-20260312-01",
      "note": "成品入库单与库位照片"
    },
    {
      "kind": "warehousing",
      "at": "2026-04-21T09:30:00+08:00",
      "ref": "EV-WH-02",
      "batch": "B-20260420-02",
      "note": "成品入库单与库位照片"
    },
    {
      "kind": "sampling_photo",
      "at": "2026-05-06T11:00:00+08:00",
      "ref": "EV-SP-01",
      "batch": "B-20260312-01",
      "store": "城东玩具店",
      "note": "货架实物与包装 CCC 标志特写、扫码结果页"
    },
    {
      "kind": "interview",
      "at": "2026-05-07T15:00:00+08:00",
      "ref": "EV-IV-01",
      "store": "城东玩具店",
      "note": "门店店长询问笔录：进货渠道、在售型号、已知销量"
    },
    {
      "kind": "interview",
      "at": "2026-05-09T10:00:00+08:00",
      "ref": "EV-IV-02",
      "note": "生产企业询问笔录：承认为赶交期多型号共用同一编号包装"
    }
  ],
  "flows": [
    {
      "ref": "F-01",
      "batch": "B-20260312-01",
      "to_store": "城东玩具店",
      "quantity": 60,
      "shipped_at": "2026-03-20T08:00:00+08:00",
      "received_at": "2026-03-22T09:00:00+08:00"
    },
    {
      "ref": "F-02",
      "batch": "B-20260312-01",
      "to_store": "城西玩具店",
      "quantity": 40,
      "shipped_at": "2026-04-25T08:00:00+08:00",
      "received_at": "2026-04-26T09:00:00+08:00"
    },
    {
      "ref": "F-03",
      "batch": "B-20260420-02",
      "to_store": "城东玩具店",
      "quantity": 60,
      "shipped_at": "2026-05-02T08:00:00+08:00",
      "received_at": "2026-05-03T09:00:00+08:00"
    }
  ],
  "sales": [
    {
      "store": "城东玩具店",
      "batch": "B-20260312-01",
      "quantity": 25,
      "started_at": "2026-03-25T09:00:00+08:00",
      "ended_at": "2026-05-05T20:00:00+08:00"
    },
    {
      "store": "城西玩具店",
      "batch": "B-20260312-01",
      "quantity": 10,
      "started_at": "2026-04-28T09:00:00+08:00",
      "ended_at": "2026-05-06T20:00:00+08:00"
    },
    {
      "store": "城东玩具店",
      "batch": "B-20260420-02",
      "quantity": 30,
      "started_at": "2026-05-05T09:00:00+08:00",
      "ended_at": "2026-05-08T20:00:00+08:00"
    }
  ],
  "scans": [
    {
      "unit": "U-0001",
      "batch": "B-20260312-01",
      "scanned_cert": "CCC-2026-7788A",
      "at": "2026-05-06T11:05:00+08:00",
      "source": "城东门店现场批量扫码"
    },
    {
      "unit": "U-0001",
      "batch": "B-20260312-01",
      "scanned_cert": "CCC-2026-7788A",
      "at": "2026-05-09T14:00:00+08:00",
      "source": "城西跨地区补报"
    },
    {
      "unit": "U-0002",
      "batch": "B-20260312-01",
      "scanned_cert": "CCC-2026-7788A",
      "at": "2026-05-06T11:06:00+08:00",
      "source": "城东门店现场批量扫码"
    },
    {
      "unit": "U-0101",
      "batch": "B-20260420-02",
      "scanned_cert": "CCC-2026-7788A",
      "at": "2026-05-08T10:00:00+08:00",
      "source": "城东门店现场批量扫码"
    },
    {
      "unit": "U-0102",
      "batch": "B-20260420-02",
      "scanned_cert": "CCC-2026-7788A",
      "at": "2026-05-09T14:10:00+08:00",
      "source": "城西跨地区补报"
    }
  ],
  "rectifications": [
    {
      "submitted_by": "玩具生产企业",
      "at": "2026-06-10T16:00:00+08:00",
      "note": "补交包装整改方案与重新印制包装的样张",
      "attachments": ["rect-plan-01.pdf", "new-packaging-proof.jpg"]
    }
  ],
  "consumer_notices": [
    {
      "store": "城东玩具店",
      "batch": "B-20260312-01",
      "reached": 25,
      "at": "2026-08-20T17:00:00+08:00"
    },
    {
      "store": "城西玩具店",
      "batch": "B-20260312-01",
      "reached": 10,
      "at": "2026-08-22T17:00:00+08:00"
    },
    {
      "store": "城东玩具店",
      "batch": "B-20260420-02",
      "reached": 28,
      "at": "2026-08-20T17:30:00+08:00"
    }
  ],
  "dispositions": [
    {
      "kind": "penalty",
      "batches": ["B-20260312-01", "B-20260420-02"],
      "cert_id": "CCC-2026-7788A",
      "cert_version": 1,
      "flow_refs": ["F-01", "F-02", "F-03"],
      "reach": [
        {
          "store": "城东玩具店",
          "batch": "B-20260312-01",
          "reached": 25,
          "at": "2026-08-20T17:00:00+08:00"
        },
        {
          "store": "城西玩具店",
          "batch": "B-20260312-01",
          "reached": 10,
          "at": "2026-08-22T17:00:00+08:00"
        },
        {
          "store": "城东玩具店",
          "batch": "B-20260420-02",
          "reached": 28,
          "at": "2026-08-20T17:30:00+08:00"
        }
      ],
      "decided_at": "2026-09-01T10:00:00+08:00"
    }
  ]
}
